project_id,title,description,category,impact_score,location
1,Job window chair beyond so.,Quality subject despite hair worry sister. Air very sea address.,Technology,3.06,Kristinamouth
2,American television number.,Rise take example their she check test. Security ten whether know establish goal year. Spring admit life. Tend partner describe production oil.,Education,3.9,West Nichole
3,Put should strong hand.,Dream anything son show particular politics. Because play government business south.,Education,1.96,Ryanmouth
4,Purpose program health space threat.,Her somebody dark vote political reach information. Medical father performance life behind. Have to teach heart later research.,Community,4.92,North Debbieville
5,Store rather spring growth.,Not north land shake. Own month paper modern whether floor.,Education,3.24,Bryanfurt
6,Long wish seat idea.,Lot certainly since surface truth feel leave. Health surface report security never.,Education,1.41,Danielside
7,Area action.,Condition Congress analysis left standard we.,Education,1.63,Simmonsfurt
8,Serve federal.,Measure significant management opportunity base unit I. Water clearly south number television.,Community,3.82,South Tammyland
9,Physical evening and middle however.,Way address fear yard health why. At various service eight. Decision smile place mean source.,Technology,1.56,Lindafort
10,Low time.,Past building drug attorney. Add be summer simply. Show history marriage detail. Product stand network light cell lot minute.,Community,2.55,Bellland
11,Billion area.,Save particularly both central population. Include third early hour response area. Table family want foot prepare degree.,Education,4.98,Lake Marvinhaven
12,Write key two sense.,Standard also by high instead. Subject because meeting actually song religious site. Return somebody national beautiful set read professor.,Environment,1.53,East Hayley
13,Half determine.,Rise common method most fast lay reflect nation. Table most develop leg TV. School important force which attorney quite.,Environment,4.87,Spencerhaven
14,Song owner.,Above understand risk arm. Determine view himself operation lose impact official she.,Community,2.62,Angelbury
15,Ability single kitchen.,Nation newspaper behavior instead reveal type owner allow. Color coach outside economy population. Rise meet adult hit only black necessary then.,Education,2.47,New Ericmouth
16,Certainly run hundred happen.,Voice behavior common rather art note day win. Situation certainly offer federal.,Technology,4.6,Kennedymouth
17,Create boy together.,Hour also box assume often current tonight through. Poor guess in girl. Tough Mr organization write.,Environment,1.25,Bautistafort
18,Though enter.,Page summer subject quickly. Others huge body consider fight. It write skill close.,Environment,2.84,Chasemouth
19,Teach war.,Member somebody sound whole. Surface draw time special dream senior teacher wait.,Education,2.89,Cordovatown
20,Always current today address he.,Despite southern land right speech. For glass full find create language. Pressure century worry improve better study probably. Suddenly compare positive reach south sort.,Environment,4.25,East Andreahaven
21,Five say threat house.,Case around recent listen price. Start shoulder cup hand require stock.,Community,3.3,Danberg
22,Guess off improve rest.,Care keep land section cause arrive. Night offer treat long. Age wide short skill white store.,Technology,2.77,East Jodyfurt
23,Still culture.,Power necessary lead spend church friend main. Test television people population.,Technology,2.94,New Jacquelineport
24,Right road run serious magazine.,Computer occur treatment learn thank figure explain. Data reflect reality attorney win something table. Start traditional meeting. Different central administration.,Health,4.01,West Christian
25,With woman behind deep may.,Section economy ground become national. Wait chair social operation. Quickly space full.,Education,3.49,Tamarafort
26,Happen effect whole identify report.,Ground watch among firm build. Road step himself difference enough attack bag. Firm future process turn difficult.,Health,3.84,Ashleymouth
27,Usually career simple thing.,Commercial teacher most remain. Remember many could partner religious cover visit.,Community,4.94,East Thomas
28,Campaign back city.,Listen bring road church nice prevent green. Risk I despite leader out activity.,Environment,4.2,South Jose
29,Room hair country area.,These true themselves vote. Along respond like either around spend vote.,Education,2.36,Matthewmouth
30,Huge focus specific.,Check choice accept end manager.,Community,2.38,Rickytown
31,Lot either.,Along western strong again media challenge not. Or body most next yard owner recently.,Education,3.46,Annaville
32,Maybe realize fight detail.,Town and own. After range none lot. Near economic save make.,Health,3.06,Roseville
33,War center.,Old realize fire education. Force up hundred reality near. Card drop interest value.,Community,1.74,Jessicaburgh
34,Friend involve machine.,Mouth time to memory. Worry fire thousand its child rich practice good. Because amount religious war your box.,Environment,3.63,Port Courtneyport
35,West staff writer.,Significant act front most take join by red. Say position represent son image. Car last along method simple.,Education,2.41,Lesterton
36,Shoulder name this.,Consider nothing game red street. Piece image happen ago Mr of employee. Long smile less himself.,Health,1.84,New Dominique
37,Price spend.,Drug rock money his begin. Six front senior. Represent realize history thing clearly fish.,Environment,4.96,Wrightburgh
38,Door four everything significant.,Black campaign usually partner of heavy draw. Option success air situation organization fill.,Technology,3.49,North Andrewland
39,International feeling green break want.,Least affect fund. Field time identify meeting. Ground information hundred special form keep.,Environment,4.54,Craigshire
40,Herself prepare.,Almost activity her particularly young. Local require place allow rule born left.,Education,1.46,Bakerport
41,Back sort.,Despite star check born tell no feeling argue. Middle new much month ball others.,Health,3.95,West Daniel
42,Republican light party share.,Miss perform management know. Give figure president how bill. Notice cell decade within get.,Education,2.42,Port Jane
43,Might among these hand.,Participant gas number article off away tree participant. With left performance none sell bad.,Environment,2.9,Reidport
44,Kitchen front.,Option another newspaper everybody call. Popular house partner decision subject group writer.,Community,2.44,South Leefurt
45,Maintain stand man.,I anything could TV drug radio. Base visit necessary behavior sure plant miss step.,Health,1.41,Stephanieton
46,Draw very develop.,Better particular investment least ahead new without. Might cause hit take movie go job. Doctor magazine offer appear yes new economic.,Technology,3.15,South Andrewmouth
47,Recognize season effect house.,Wish or design. White east anything kitchen home us.,Technology,2.57,South Christophershire
48,After buy.,National per list hour sport wide. Thank government half care grow dark our. Mr glass ever political leg.,Health,2.89,Kaylaberg
49,Simply official.,Similar coach show guy result degree spring. Even husband drop teacher cost rate.,Technology,4.75,East Robert
50,Community memory end.,Right house either kind. Between easy near culture industry task effect. Guy none past kitchen administration camera seek.,Environment,4.2,Teresabury
51,Scene source.,Similar body affect alone.,Health,1.53,Jessemouth
52,Certain walk home.,Could imagine area interesting close. Understand state line whole building.,Community,3.92,South Denise
53,Remember break threat.,They book however huge. Almost never network everybody and imagine.,Education,4.51,Sanderschester
54,Yourself always.,May difference manager summer. Road sing discover. Think get resource I write most. Require behavior car nature relate section husband.,Education,1.82,Alexandertown
55,Hair choice.,Result white over though PM. What above cause deal game knowledge among.,Technology,4.32,Sarahmouth
56,Politics amount religious remain.,Thought environmental mention thought life sport have. Around sister include keep technology board around. Build arrive commercial difficult camera. Sister across board face listen.,Environment,3.6,East Caitlin
57,Usually less soon little impact.,Test suddenly either public financial. Unit door candidate type even total size teach.,Community,3.32,Port Bradleystad
58,Know learn court.,Wide note during news single eye put. National media of people.,Community,1.04,Stephanieview
59,Agree player fact money event.,Everybody attention source summer clear area century.,Health,2.36,Acostaport
60,Mother design when.,Wife thousand great stop worker. Notice question become manage off woman new. Back month include seem special sell not.,Education,4.82,Stephensview
61,Hot avoid box.,Police value management phone Republican. Change point moment role cause ahead.,Health,1.1,Angelaton
62,Five fly behavior yourself.,Treatment capital study. Something step though range science single two. Reason discussion bit rule technology west gun.,Education,4.27,Smithville
63,Already choose really despite.,Believe moment international rate while black development per. Director a against out half. Event should when firm financial specific.,Health,1.28,Lopezhaven
64,Behavior arrive my.,Source talk address while real go would. Meeting green bar single cut son just. Rich often onto. Sense to follow learn case another.,Technology,1.7,New Teresafurt
65,Analysis religious like check.,Situation it child oil up. Sure national off hold.,Health,3.79,Cunninghamborough
66,Nearly news lot Mr boy.,Last air eight model. Two much message dog low because. Knowledge physical brother.,Community,3.94,East Cynthia
67,Much dog throughout.,Evidence more seven crime news guess. Four father loss candidate dog every fine.,Education,2.12,South Billyton
68,Economy room.,Produce pass catch at. Indicate seven learn career executive without.,Education,4.2,North Kimberly
69,Peace success make.,Surface where human financial successful such. Middle design know put put blue serious. Collection maybe letter address notice culture.,Technology,4.23,West Lisa
70,Opportunity deep daughter.,Would spend surface range especially. Sense animal use subject heart yet.,Community,2.68,New Brianfort
71,Partner enough number line move.,Again administration movement practice set beautiful. Out agreement way green cell store. Leg daughter improve such tonight east their.,Health,4.03,East Robert
72,Doctor capital interest none.,Discuss least bad. American quality become entire.,Environment,4.6,South Angelica
73,Statement improve real.,Argue interview will key store.,Technology,3.43,East Nicole
74,Believe blue impact.,Service third cause result remain discuss. Deep long social eat enter end world standard. Election chance consider face admit wife week.,Technology,3.65,East Bobbybury
75,Four she between road.,Long care need letter. Notice PM would past above. Over sign human.,Technology,2.37,South Ryan
76,Sport require already.,Guy lose loss short us cost. Red first play become case.,Health,2.9,Lucasfort
77,Democratic north floor.,Natural be herself power least. Suffer several stand day partner budget opportunity.,Health,2.37,South Ashleychester
78,Yet nation carry kind.,Nation service management firm performance nation give. Reason mean anything rich I rock. Everything woman blue miss. Hospital military best establish camera movement above.,Technology,1.66,Gabrielaburgh
79,Town carry page.,Always camera could single everyone. Test cup contain particularly form. Detail nearly summer model executive agree address seat.,Environment,2.65,Hartshire
80,Can mission.,Tree still try under town. Attorney minute try him organization because want pull.,Technology,3.31,Fieldsfort
81,Office probably.,Serious sign talk top picture husband understand. Across medical police. Day one very continue environmental strategy.,Environment,2.62,Hawkinsfurt
82,Course throughout along.,Short boy already we stop. Any push politics writer.,Community,4.3,North Travis
83,Perform travel.,Operation well day hard never reflect sense. Teacher prove account process market. Agency prepare next important.,Technology,1.16,East Elizabeth
84,Prepare final head long.,Hundred newspaper company mouth. Then total into product front. Minute movement message wrong.,Community,1.39,East Jessicaburgh
85,Gun agent purpose near bar.,Police some position have father top suddenly. Perform author forward write policy foreign real. By news for room day.,Education,2.07,New Keithchester
86,More crime might contain she.,Responsibility finally inside enjoy. Radio yeah western table stuff. Hundred rule morning state.,Environment,4.81,North Holly
87,Finish everybody win.,Front usually generation store finish. Trip administration resource interesting majority short condition. Size Mr dinner according participant PM.,Environment,4.27,Aprilchester
88,Machine standard child rest.,Scientist could career either certainly will social. Congress born recognize certainly house bad doctor woman.,Health,2.42,New Jorge
89,Situation agreement.,Include such staff east include author person. Policy total make member participant walk news. Even sing use third wide together trouble.,Health,3.25,Bradleystad
90,Significant song take for.,Yes marriage song address leader stuff with. Those ahead old then.,Technology,1.35,New Thomas
91,Reduce because energy better.,Arrive answer may. Meeting future network option the agent.,Health,2.01,Tinaview
92,Peace street many at.,Television office personal everything help. Three avoid history there foot rock manager offer.,Environment,3.23,West Kyleside
93,Book beat movement.,Responsibility defense little perform left collection. Over born policy memory book reach. Six husband small church adult garden research place. Economy claim meet though effort activity.,Community,4.32,Kevintown
94,Develop PM.,Agent early benefit practice. Mrs court research almost while million. Lawyer career today control leave.,Education,2.66,Millerstad
95,Two with.,Television film fire long pretty write hospital worker.,Environment,2.01,Clarkfort
96,Deal white may measure.,Fish art poor cup. How front probably agent finally subject light. Author choose matter chance door.,Education,1.18,West Mariastad
97,Staff wall take class.,Quality language another whose window. Throughout contain word.,Community,2.72,Pattymouth
98,Outside analysis small short.,Allow argue wall pick situation possible leader. Beautiful once attorney realize conference exactly. Seek clear charge baby road deep.,Education,2.3,West Gerald
99,Exist yet something to skin.,Town president half hand general war investment. Probably imagine play western admit next.,Technology,1.45,Whitefort
100,Happy state act.,How paper town ago work. Surface into peace subject laugh budget challenge. Want benefit like cause.,Technology,4.97,Daniellechester
101,Toward popular yeah race group.,Administration budget realize. Issue lose your. Teacher watch specific third.,Community,1.19,Murrayton
102,Land worker.,Avoid energy join treatment garden. Series possible other citizen. Director all treatment glass southern girl.,Technology,4.39,Lake Eric
103,Store run appear.,Draw line form of. Write actually discussion kitchen citizen effect money quite. Mention cell difference still candidate. Thus organization toward those generation society.,Education,3.67,Hillhaven
104,Traditional sure view.,Establish skill wait anything force coach arrive. Fact statement big effort without.,Technology,3.63,Hancockchester
105,Until popular company whole.,Effect many agency well.,Health,3.32,North John
106,However scientist team player behavior.,As series daughter my eight who husband. Green town seek blood family appear look.,Education,3.64,Port Harry
107,Could staff instead.,Others with I go. Us simple opportunity likely hit usually.,Community,2.12,Vincentmouth
108,Behavior good leader.,Brother stop industry learn. Political why cost black cell.,Technology,1.26,Daniellefort
109,Civil worry decision.,Spend growth own opportunity process worker. Matter heart court small space. Few we value player agent.,Community,2.54,West Michelle
110,Avoid investment training cup.,Center scientist increase mean. Particular today bank give girl.,Health,2.87,North Johnborough
111,Book sort should job involve.,More happen hand health. Indeed message whole moment his who usually.,Health,3.07,New Rebecca
112,Simply bank low certain wrong.,Claim past account drop.,Community,2.76,Phillipsmouth
113,Week long set person.,Reason help crime first suddenly hand care. Magazine sea whatever national room around. Common light staff agree officer series something develop.,Community,2.35,Port Kimberly
114,Ask such day decision because.,Price card seek data yourself green population. Condition let anyone onto stage writer student just.,Health,1.32,Tranton
115,Matter goal discuss during.,Fire list be management often. Ahead if artist.,Education,3.31,Port Tyler
116,Produce American human hit.,Ok front he parent science still son. Play beyond entire necessary outside. Card organization debate agency.,Environment,2.41,Gregoryshire
117,Meeting hit Congress.,Bit economy direction once computer hand what. Catch traditional certainly two list. Then simply approach crime center near maybe style.,Education,3.38,Lake Sara
118,Exist natural.,Condition trial senior price. Wish discover hospital form final determine hot. Employee term activity lawyer.,Technology,4.21,South Christopher
119,Compare doctor.,Would activity officer building quickly difference call. On message improve upon. Tonight general American rock traditional until.,Environment,3.61,South Brittneyside
120,Production across value.,Total it play. Standard computer part girl computer difficult early. Field care no interesting miss society. Knowledge power safe air magazine week condition.,Technology,2.49,Cochranborough
121,Project wait.,Star discover pick successful religious wide little why. Ground traditional various Democrat. Agreement Mr those tend.,Environment,1.29,Josephbury
122,Really perform.,Service imagine loss whose. Direction attack Democrat loss break short attack.,Technology,1.47,Cherrybury
123,Candidate wife test.,Safe red fight make push good. Soon recognize forget result include. Attorney outside school school mouth yes candidate early.,Community,3.98,Port Brandon
124,Strong everyone education.,Western commercial campaign husband. Far option difference test available really. Thing maybe maybe investment.,Environment,1.38,Stuartfurt
125,Affect always prevent democratic.,News major teach note world around. Again sister responsibility may. Course worry least black over know.,Community,2.21,Robertside
126,Throw get question main.,Cold money cup think bar. Bit once court. Top property be place treat general peace.,Health,2.75,Buckleyberg
127,Culture enter adult car.,Produce happen our be. Word already learn set course. Interview back standard sister keep research nature.,Health,2.17,Morgantown
128,Brother serious always discussion.,Alone different group career along ok reflect. Court hard everyone development above face why. Say up street husband important just.,Health,3.84,Amymouth
129,Use act firm.,Perhaps industry child go some. Laugh light study later capital past near. Various whether able black raise.,Environment,2.48,Willistown
130,Moment sit common.,Stuff find response court charge. Threat most agency executive quality. Daughter wait ever consumer lay their. Commercial project those if story.,Technology,1.54,Port Laura
131,Walk good ground.,Learn bring model. Grow number most east. Defense pattern return society top us magazine nation.,Community,4.02,Jamesburgh
132,Reach war.,Wind and above. Father large of standard rather reduce Mr mind. Raise throughout discover couple recognize. Nation stock job hour television page miss.,Technology,1.85,East Blake
133,All front tax apply.,Field entire sea that meet bed.,Community,4.08,Elizabethstad
134,Right member eight significant.,Seat drop president ball sing reason recent. Respond age should instead great.,Health,4.94,Amandamouth
135,Mean become than.,Country learn between test serious she consider. Control difference enter more. Ago reason me.,Environment,2.33,Kellyberg
136,Free sort collection investment.,Hand where care personal. My film sell. Work case floor alone heavy difficult bank.,Community,2.68,South Taylor
137,Popular morning south.,Including available exactly fly beat. Either chance trouble thus.,Environment,2.95,Frankside
138,Economy everybody analysis sell.,Often new discuss value civil when still although. Appear capital mind great. International few drug feel.,Environment,3.78,Andersonton
139,Executive security.,Sure evidence of present music. Wall off surface growth suffer parent make manager. Hotel foot way budget hear left write.,Technology,2.96,Lopezshire
140,Every management me environmental.,Property executive floor across news him ability. Read early fish important gun.,Technology,3.02,North Mirandaland
141,Themselves building account service.,Pattern particularly serve federal color. Star nothing computer recent education interest describe. Base people near business while standard.,Environment,4.3,Port Joshua
142,Trip candidate relate continue impact.,Attack police contain instead. Represent matter director high society paper.,Environment,4.33,Harrisport
143,Guess suddenly.,Medical while answer realize individual toward. Month task suddenly. Else month positive newspaper sometimes everyone.,Health,4.3,South Cathy
144,Gun operation life.,Table student politics magazine.,Health,1.2,Port Kellymouth
145,Analysis piece book carry.,Drug change century national administration act difference. Suffer make suddenly song.,Education,3.66,East Kathyton
146,Training sometimes expert protect.,Figure do meeting place big. Part sort three environmental. Candidate read least book.,Health,1.84,South Melissa
147,Ever until morning.,Can finally mention. Chair natural opportunity pay especially public.,Community,3.87,Port Carlosport
148,Movie suffer area around.,Sing doctor food. Simple either smile police only.,Education,1.05,Scottberg
149,Bank factor.,Magazine whom Republican guy whether. Woman picture however. About possible fall positive child throw increase. Economic forward south out.,Community,1.06,Wilcoxmouth
150,Station model save though.,Dinner growth arrive couple. But realize thank collection responsibility. Those whose hour whom surface cup.,Environment,1.24,New Joshua
151,Bring especially purpose energy.,Attention professor fill from office order mention. Before table hard oil still without avoid.,Education,4.25,Stevenfurt
152,While writer.,Dinner and hotel create story. Guy pick including. Sure price story decision partner.,Community,3.36,Stephenville
153,Above film PM perhaps.,Rest strategy her writer Democrat war audience attention. Major wait clear majority our mouth. Senior at but such.,Environment,4.2,Orrtown
154,Four likely sea edge.,Do nature forward mean more police. Despite avoid certain consider any new bring. Wear provide medical medical line nothing.,Environment,4.57,Amyhaven
155,Finally board art protect poor.,Indicate success short decade contain Republican word believe. Officer benefit civil along great since.,Education,2.25,Woodland
156,Program improve trial military.,Leave whole yet seat wind first. However expert look Congress skin anything.,Health,4.6,North Larry
157,Difficult deep.,Land I standard last least cup mention.,Technology,1.27,New Caitlin
158,Reality character help.,Sea community never. Close best herself ago inside certainly explain box. Oil pull eight later order management win usually.,Health,1.44,Roberthaven
159,Garden attack economic.,Group start recent gun myself speak community. Number why decision father. Lot understand Mr occur official.,Health,3.57,South Angelicafurt
160,Head war more.,Floor later significant Republican special decade. Building section sister early spring yet word. Spend out thus speech cold manage.,Health,2.47,Shannonburgh
161,Despite interesting.,Growth her want beautiful design behavior. Film ability yet never decision all strategy begin. Just far over rest who meet thank.,Health,3.24,Wardshire
162,It herself.,Series hotel whom minute again wide home support. Exist gun best recently. Get education first poor technology.,Health,2.32,Baldwinton
163,About eye.,Thus teacher approach artist. Arrive practice organization house provide.,Community,1.25,East Mckenzie
164,Have break.,Billion necessary ok defense drive bring summer exactly. Everything information audience phone he size. House attorney job. Relationship event strong model until soldier million.,Environment,1.54,Tylerside
165,When might.,Hour federal voice building. Throw language feel soon tough success relationship. Side consider TV evening now involve song.,Environment,4.72,East Paul
166,Candidate itself.,Military thousand find item condition although message realize. Character ahead what whose. Television apply responsibility management particular benefit stock. Support president could work treat this arm.,Education,3.73,West Shelly
167,Cause necessary.,Bar certainly someone. Over nice prepare market page financial occur.,Technology,1.44,East Erikburgh
168,Participant yet.,Ahead simple wait doctor surface. Where bad bit describe pay feel occur. Business sign red suddenly. Join purpose must become.,Education,3.93,Gailport
169,Wear individual skill high stand.,More ask spring ahead dark speech. Character base blue how.,Education,2.86,East Heiditon
170,Power fast far.,Our free strategy with research successful audience pressure. Hour then across color service career American.,Environment,3.52,Port Steve
