project_id,title,description,category,impact_score,location
344,Health yeah.,Movie system meet present officer hold half. Your now save use after trouble. What feel whom cover page morning yard.,Community,2.48,West Stephaniefurt
345,Contain sure.,Themselves check note point effect my participant. Hard especially simply travel ten ten. On mean thought every hold difference.,Health,3.13,Bushfort
346,Adult then change future.,Fire record although defense similar without very. Speak run minute. Know against sure citizen.,Community,2.32,Williamshaven
347,Father phone.,Course wonder process nice back budget. Civil school system yard. Price seven firm along.,Education,3.76,West Kenneth
348,Performance short movie onto.,Bill front save represent machine herself. Make ask authority.,Education,4.57,Port Daniel
349,Board beyond can.,Imagine fear look everyone figure feel method.,Education,4.48,Victoriaborough
350,Decade American right.,Seven issue many relate. Single suggest mention purpose suffer happen. System skill may total finish.,Community,3.27,Steeleberg
351,Game play eight until.,Author bag account five. Off serious unit project early reach include.,Education,3.73,Lake Shannonburgh
352,Two election film quality.,Chair heavy point each. Trial blood decision share. Create owner hand his.,Health,2.87,West Ryan
353,Important foreign partner anything.,Impact point personal test include foot add follow. Opportunity look modern total home listen alone.,Technology,1.97,Meganside
354,Behavior position act point.,Industry television PM inside authority crime. Great street role. Carry hit those ball its.,Education,3.24,Davidsonstad
355,Friend week.,Last chance morning respond store. Worry deal card turn.,Technology,2.18,South John
356,Our send.,Degree near main movie think. Everyone into section floor when even property region. Act single knowledge agreement.,Education,4.46,Lopezville
357,Leader during note.,Point become partner for television minute alone authority. Bit focus explain security.,Community,4.27,Royville
358,These health next heart.,Pretty window some place hour family. Skin wish key film. Cost standard sit memory.,Environment,3.55,West Justin
359,Once parent much.,Campaign among voice example. Imagine tough hear. Artist left concern.,Environment,2.31,Bradleystad
360,Outside school sell suffer.,Himself million really practice choice form. Yeah significant finally why nation.,Technology,1.07,Reedhaven
361,Window age some star.,Yourself wrong evening attack poor teach. Smile top exactly political be measure.,Health,4.78,Allenport
362,Owner spring above quality.,Contain debate week consumer power. Positive production high discuss trial. Admit move ability great condition audience. Him another ready cell political network.,Technology,2.03,West Williambury
363,Thing thought interesting determine resource.,Word man perform effect. Plan go into power prevent.,Community,1.43,Scottmouth
364,Song member.,After strong step meet all. Enough minute determine your present piece. Design despite operation fear no.,Health,3.45,East Brian
365,Ball know despite.,Speech five situation agree fire sound where. Choose among modern. Seem most sign live.,Technology,2.32,Lake Marissa
366,Dog ball student.,Entire because back property know. What what treat career which. Practice fine own by. Right network all statement.,Education,1.75,Gregoryside
367,Group song already up.,Tough difficult their bar draw key claim. Focus check trip fine whom citizen can. Increase section grow commercial.,Technology,2.55,North Scottside
368,Activity myself talk.,South western fast though let entire vote. Center kitchen spring likely different question. Rest choice provide fire factor center dark choose.,Health,4.44,Terrellberg
369,Few line.,Tell simple because agency bit. Decision you according much reason focus. Appear fill rich nor reason.,Community,4.95,South Amyside
370,Threat role.,Free us TV pattern. Several chance way sometimes. Might one indicate all.,Technology,1.83,New Christinemouth
371,Sport job employee score.,Contain only mission people.,Technology,3.54,Jefferyland
372,Amount arm performance.,Teacher strong finally others music at thought. Certain guess soldier southern person.,Education,2.07,Paulmouth
373,Total story water.,Notice tree less understand attack tree. Reveal range as notice society social. Six art these technology event.,Environment,3.93,New Cindy
374,Forward few so during.,Light and executive project hour population.,Technology,2.4,Henryshire
375,Cell family listen.,Dream if although to. Who indicate fill best. Son the inside money participant sense reflect.,Community,3.98,Port Sheilaton
376,Itself sing.,Public heavy family catch agent involve support. Style land doctor clear discover in do. Eight them family.,Environment,2.44,Lake Kristintown
377,Building every lawyer.,Whatever born she rock. The energy sometimes case director enter media. Suggest value president quickly school.,Environment,4.17,Robinsonstad
378,Sit want heavy daughter.,Read yourself out act time majority. Forget nearly history.,Environment,1.51,East Steven
379,Guy run thing have.,Central most effort. Nothing often lose.,Environment,2.91,Walkermouth
380,Another its action decide practice.,Student radio poor across believe number. Pm total center happy recently sometimes. Somebody international quality region able seek become.,Health,2.52,Port Michael
381,Pressure home goal.,Science important above away.,Education,3.26,South Sarah
382,Wide speak media reflect.,Sound identify our certainly lead fund enough. Model foot against wall good her field. Shake cost same serious.,Environment,2.71,Markbury
383,Care reduce century available.,Write ahead mean there later. Item bar policy early cover.,Education,1.23,Port Jodyview
384,I technology degree ball.,Alone yeah now soon power much.,Health,4.77,East Kimberly
385,Training he almost nature stock.,Surface man hour middle marriage nice. Suddenly purpose develop. Two show accept ask single.,Environment,2.79,Meganmouth
386,Yard read your.,Reflect full today see different already peace. Newspaper add close something end.,Technology,4.2,Lake Matthewmouth
387,Sell thousand wear less.,During station teacher its pattern sound. Establish machine painting short cup investment here.,Technology,1.37,Port Lisaport
388,Speech need.,Art sit but art enter. Agent couple should kid strategy human.,Health,4.82,Moralestown
389,Evening man leg share.,Television head how once life general. Pull piece campaign represent. Leave manage use a kind note wish.,Environment,2.35,New Holly
390,Generation action.,Also entire popular relationship. Practice what knowledge record anyone will wind. They it reason room available research feeling. Remain the Republican well party receive sea write.,Health,3.22,Lauraland
391,Often artist.,Back stand government any. Record face million black suffer join effort price. Process language question group.,Health,2.29,Lake Geraldchester
392,On cover skin usually.,Policy cold teach receive million. Series would yard really act ball.,Community,3.27,Webbville
393,Five artist life face.,Story strong tonight especially talk laugh such. Leader listen compare clear garden threat. Realize forget himself second.,Technology,4.32,West Amandafort
394,Offer radio.,Painting here knowledge bar. Various best off believe key.,Education,1.35,Brownside
395,Single book and on.,Full final bit goal play source leg paper. Speech several shoulder off. Suddenly draw note.,Education,1.56,Lake Allenbury
396,Indeed happy clear itself.,Recently billion score off. Yeah recent its pass fact finally shake music.,Environment,3.27,Port Tracyport
397,Enough many national.,Eight resource hand scene prevent. Story center size small during involve.,Health,4.77,South Kenneth
398,Common head.,Well pressure discussion recognize brother speech. Perform ahead along small time movement.,Health,4.03,West Karen
399,Describe use since.,Dream thought order realize factor statement interesting. Again maybe brother source piece worker.,Community,4.06,West Brendastad
400,Contain significant happen against recent.,Decide condition safe future maintain industry southern.,Education,3.45,North Theresa
401,Possible different walk.,Son visit blood compare write. Population occur trip. Paper through think unit yourself religious fill.,Health,1.6,Jenniferhaven
402,Continue door owner list.,Tough suffer dog where. Man close old.,Community,4.73,Brendastad
403,Show several information record.,Happy industry rather over break. Sort lose few door.,Community,2.99,Port Carlos
404,Interesting road.,Happy stock image sense. Community share smile.,Health,3.48,Morrisshire
405,Movement hundred.,Seek wear pressure hotel home character thought. Investment local process along. Trial dog activity tree treat.,Health,1.53,Colleenbury
406,Later particularly poor father.,Tonight tough my already task return key. Call over office glass food discussion over.,Environment,2.54,North Breanna
407,Natural play piece.,Learn find me movie five possible wait. Thing spring indicate drive look.,Community,4.74,Lake Michaelstad
408,Eye never ago address couple.,Would any police star member. Room letter hope sing of. Cut contain institution mean candidate name from bank.,Technology,1.08,Maysborough
409,College never low form.,Total threat tonight. Floor house street money second. Improve through degree what place night.,Health,3.1,Brookemouth
410,Return protect head under.,Leave because true common. Her rest hour executive light red at. Appear see back out book set.,Environment,1.43,Lorihaven
411,Every garden relationship.,Surface of benefit whose white employee positive. Former course cover build style three. Blood manage cover notice.,Education,4.61,Lake Marissachester
412,Guess can others shoulder.,By its hit computer. Direction Mr success war citizen support only. Song cell capital over others protect of.,Environment,1.96,Kelseyhaven
413,We eye matter.,Need pay major. Act it else accept program drug. Feel relationship which name another offer.,Health,3.26,Lake Kevinview
414,Spring how office baby.,Color arrive hotel serve two education. Million soon tonight skin hair. North sort court argue administration short team.,Technology,3.22,Castillostad
415,Phone mother car next management.,Participant figure picture environmental cultural perform scientist. Growth too international another physical series.,Education,1.35,Coletown
416,Wife open manage her.,Somebody debate enjoy research degree. Respond two might behavior message rise speak. Central leave task region level during.,Education,2.75,Danielburgh
417,Process rich image.,Whom contain owner bad. Why Mr within. Group everyone whether lawyer world open.,Education,3.46,West Chelseatown
418,Rest vote contain.,Find few member treatment everyone. Team long through situation guess catch personal. Wrong push key however.,Health,4.52,Townsendbury
419,Control husband accept family.,Sell provide night heart large finally approach father. Can too range we. Itself still either east leg evidence.,Health,3.59,Woodview
420,Fire concern size I pretty.,Close benefit change town administration. Customer color act name by election discussion. Reflect enter modern another.,Environment,3.28,Nolanmouth
421,Line thus must pressure.,Meeting part sort. Activity through budget walk stuff.,Environment,2.17,East Kimberly
422,Ask guy all fire plant.,Present value statement but girl. Whatever every a city chair. Series item present son again cost.,Technology,3.73,Sergioland
423,Store establish foot.,Recognize baby avoid benefit particularly sort whose. Born speak six amount foreign. Board right about.,Health,3.0,Theresaland
424,Ground difficult join.,Sell Mrs unit probably. Realize traditional customer sense fly serve. Total particular parent road south power.,Community,2.41,Amandamouth
425,Program else party people.,Fact brother investment news wrong main professional both. Her down director sport.,Environment,4.15,Allenmouth
426,Blue establish song experience.,Apply government remain boy. Continue instead outside eat. Those specific receive. Outside people station beat law.,Health,2.25,North Ginafurt
427,Reflect million scene act.,When industry national sometimes method guess rule. Soldier easy boy Mrs.,Education,1.62,Mckeetown
428,Before such one mention.,Hit pass focus production. Natural care word. Eight someone interest.,Community,4.35,Deannafurt
429,Wrong summer special language throw.,Realize room wonder protect not. If piece company everything step what.,Education,3.59,Jacksonland
430,And age huge us.,Hope pattern only without. Data spend stand about. Room have blood travel religious goal.,Technology,4.35,New Timothy
431,May four no.,Board character number. Real southern political sense least.,Community,3.2,Ericside
432,Become daughter.,Or hour bar international.,Technology,1.78,Sloanchester
433,Anyone weight model.,Offer participant professional clearly occur theory. Development stop least effect particular once. Window even attack each final method sing.,Technology,3.13,South Shelby
434,Participant cultural successful sometimes.,Its per since treatment manage. Ever adult you often bed specific evidence.,Technology,4.46,South Melissashire
435,Cultural answer enjoy during.,Stop you behind wonder hair town peace. These article security wear deep feeling various. Husband company send though different large strategy.,Health,1.98,New Ronaldburgh
436,Company quality worker.,Long third marriage listen mother key. Admit rise reflect little. Top base day degree again.,Technology,3.59,Brownton
437,Unit above way bad.,Sing old argue rock fight what. Rule wait value carry then evidence against industry. Energy us line enter garden specific door.,Environment,4.19,New Russell
438,Discover off evening.,Mrs suffer measure return finish ever source.,Environment,3.76,Adrianmouth
439,Back discuss.,Half hotel once by customer. Spring pretty culture population western throw population surface. Walk later project cell rich.,Health,2.79,Simpsonshire
440,Unit old exactly position.,Large system resource far how accept side. Hope room music prove.,Environment,4.58,West April
441,Miss stock morning return we.,Hour president kind not left. Specific well fall second improve. Know development whom avoid.,Health,3.72,Alexanderland
442,Group American president reflect.,Always Mr structure coach computer. Get reflect player mention draw must. Attack perhaps ever too sure audience never.,Community,4.32,Gutierrezfurt
443,Part far memory behavior.,Body dark debate treat charge material. People despite fill across teacher crime agent.,Health,3.46,Sandramouth
444,Once he hit yard.,Art simple both. Computer something feeling who health check law. Provide image consumer behavior mouth if series.,Community,2.0,North David
445,Coach south pretty plant.,Mission instead return current. International purpose white girl simply help want. It meeting natural great every tax.,Community,3.58,Port James
446,Often nor later size.,Go care more international student outside. Strategy spend finally war say sit industry. Together western evening amount election indeed.,Environment,2.25,Willismouth
447,Yet claim treatment order billion.,Technology middle relate nation rest state. Mouth our money market growth especially.,Community,2.96,East Nathanielville
448,Yet rule continue.,Between program fish order today prepare. During itself six line leave.,Health,3.74,New Amyton
449,Tell traditional.,Manage environmental somebody operation easy notice. Move social seat yet safe this enter company. Special determine where science fly oil six. Into stuff others.,Environment,2.81,Vanceville
450,With help.,Land federal policy indicate smile poor cultural. Marriage perhaps base number.,Technology,4.61,West Victoria
451,Produce six explain voice source.,Race social face allow common mother movement imagine. Bank collection attention ask. Help check month environmental despite box through.,Education,3.39,South Lauren
452,Act a wall car owner.,Hotel public model receive visit. Project soon form person when. True make respond southern activity.,Education,4.84,South Jennifer
453,Approach kid institution.,We hospital reduce man others. First rather between discover.,Education,2.98,South Erinmouth
454,Office imagine card event finish.,Police write share thing fill stand win. Drop allow party herself alone list.,Education,2.44,West Rachel
455,Happy color space last may.,Anyone certainly tough floor. Skill serious eye. Very sea wrong author put everybody.,Environment,3.13,Wolftown
456,Reality world home why environment.,Leader find standard participant state certain activity. Appear east this tend.,Community,1.39,South Nathan
457,Local good hotel.,Attention sea theory stock. Red nothing but any everything military.,Community,4.75,Port Williammouth
458,Responsibility determine top song.,Before treat country hit nature herself notice. Form second husband hard green ready. Produce especially consumer have call.,Technology,3.41,Sheppardburgh
459,Hair rest behavior such.,Above appear technology under old. Card little issue ten. While identify industry clearly herself whether nation.,Environment,4.53,North Jennifer
460,Candidate by attack arm.,Politics force per. Scene next seem song laugh carry. Education foot amount. Mission actually drop husband myself investment condition.,Technology,4.86,Michelleton
461,Mission rule TV.,Sing service pick bar boy million customer support. His all specific international across hotel start. Painting strong glass late.,Technology,1.5,Huangton
462,Purpose late read include.,Include peace behind against another.,Environment,4.48,Port Stevenshire
463,Purpose entire daughter.,Street stop value red audience international college bring. Across feeling dog usually make name yard.,Technology,1.48,Zunigatown
464,Race pattern in local.,Garden fear bad age speak community.,Education,3.01,New David
465,Politics natural month power.,Follow million personal discover. Five late couple book party office grow. Yet answer player employee common question machine.,Community,2.16,South Gregory
466,Matter fact compare put add.,Interest play oil cover. Skill power radio. Cost age measure bed box data especially.,Education,4.21,Powellburgh
467,Team future although.,Program major international apply bill. Hit open vote be play other task area. Later strategy this.,Education,1.01,Kevinshire
468,Beyond son worry current.,Especially agree plant including meeting. Few when police. Offer four occur wish difficult mouth season.,Environment,3.73,Alyssaland
469,Now see recognize.,Opportunity set who throw we project. Her check far step. Way detail cover show.,Education,4.77,Mirandaville
470,Operation protect your much change.,Ahead mention pretty natural. Direction beautiful sit federal yes. Democratic Democrat tree official check.,Education,3.61,Ariasview
471,Enough successful by.,Position wish high watch voice why go. Eight organization him several voice. Country trip watch say.,Environment,4.29,Amandastad
472,National toward local analysis director.,Deep high shoulder rich where either. There decade between east.,Environment,1.48,Emilyville
473,Say unit single Congress try.,Yes rock real administration office during. Half always live on recently itself.,Technology,3.86,Christopherville
474,Part data.,Life up use to car point hope. Decade notice near community stand opportunity. Those relate start finally short oil.,Technology,4.85,Ramirezhaven
475,Space capital soldier view budget.,Trouble gas wall either. Join decide wait win. After standard structure.,Technology,1.31,South Benjamintown
476,Begin set floor job morning.,Compare prove sound become reveal these. Move loss forget lay right appear simple detail.,Education,1.3,Amyville
477,Region chair chance bed.,Attack say notice enjoy. Computer skill good film. Act phone important send report still.,Technology,2.52,Seanville
478,Who field it.,Gun ball already them. Couple administration national practice soon indeed well.,Education,2.54,East Angela
479,Wife hospital.,Me finish site environment voice ground.,Environment,4.66,New Nathanhaven
480,Source affect receive care.,Appear north particular so.,Education,1.48,West Hannah
481,Likely spend.,Available such picture four eight middle. Clear start professional laugh political evidence. Discussion how wide could air.,Environment,4.82,Port Joseph
482,Message prevent media research.,International truth future together actually. Concern newspaper environmental goal then. Young develop reduce where answer art return.,Education,2.65,Quinnhaven
483,During that her.,Air provide natural. Choose sing administration herself food any.,Education,2.44,Burkeport
484,Own subject reach four enjoy.,Other end get pick oil. Report around picture watch century media.,Education,3.83,Lake David
485,Line cut firm.,Money scientist growth lead ahead. Too stuff although represent interview reality.,Technology,4.96,Franklinstad
486,Author produce would everybody.,Kitchen chair result. Lot far product commercial together about various. Prepare various grow camera.,Health,1.46,Melaniemouth
487,National great somebody manager end.,Scientist choice me heavy read but. Or human science picture. Avoid figure investment local ready.,Education,3.49,East Jameschester
488,Effort bank notice specific.,Take campaign somebody moment policy. Turn lot reveal senior pass.,Environment,2.96,Davisshire
489,Ago out music.,Follow more door voice big inside system. Fund identify option from usually person build bank.,Environment,1.07,East Allison
490,Edge ok meet low everybody.,Short pass finally we or fight sea. Especially exactly school Congress quickly simple structure.,Technology,2.22,Maysshire
491,Worry suggest when movement.,Fill support especially book. Management evidence teach reveal top lawyer forward. Finally form production say perhaps reason event eat.,Education,2.02,East Latoyaberg
492,Be capital throughout glass.,Toward state great represent people. Require become movement face worker friend.,Community,2.82,North Michael
493,Page fight difference team.,Traditional our big show method. Could good many home.,Health,4.98,Madisonmouth
494,Executive picture.,Per fast research four whole interview majority. Along thus bank class ten music cut. Subject meet success involve model. Put some media perform everything.,Community,1.11,South Paulstad
495,Democrat anything fish walk decade.,Material politics gas soon dark according. Man beautiful say out radio. Fill positive since yourself make then almost.,Technology,1.07,Alexanderberg
496,Dinner identify.,Course ground director performance able return. Medical modern with return issue eat. Night drive key real early maintain.,Health,4.07,East Laura
497,Look yes travel ten.,Front ball save. Happy them guy begin much across. Know word health avoid weight. Eight out great future material TV.,Environment,4.58,Grossville
498,Somebody degree develop medical collection.,Meet factor guy once on population TV lose. Before soldier upon lose. Meeting star to energy someone remember.,Community,1.76,Sandyfurt
499,Laugh star strong.,Two standard just unit wish single. Hospital ago yet chance. Physical treat business at force dream.,Education,2.37,Ryanside
500,Beat need.,Billion whom camera big whom everyone nation. Remain rich industry agree address. Human interesting why second ok.,Education,2.17,Garnerland
501,Move traditional short fear.,Mind wish future religious work blood deal government. Interview set skill popular appear play area law. Bag thousand tax hit.,Technology,4.29,North Steven
502,Mind because imagine wall.,Where test color machine. Newspaper my morning business drug. Matter star single them major get Congress.,Education,1.54,North Shirleybury
503,Any start great.,Dog area it edge culture speech. To green will ten computer ready.,Technology,4.18,Port Laura
504,Item eye feeling forget.,Change give probably hot strategy news call home. Government develop blue wide effort.,Community,1.83,West Cliffordport
505,Magazine subject fly.,Answer these site large to western population along.,Community,4.15,East Charles
506,Cold prevent open former.,Card close activity foot choose. Whole lot poor ability investment. Firm national blue call room citizen interesting.,Technology,1.3,Lake Matthew
507,Fall art word many.,Usually once herself thousand perhaps significant.,Education,4.66,East Johnathanville
508,Catch coach continue hand run.,Condition blood available onto any politics analysis. Lawyer personal begin property almost. Agent character list he customer free.,Education,4.48,Lake Stanleyview
509,Compare pull thing enjoy.,Unit poor billion conference million. She billion garden.,Health,2.11,Port Emily
510,Less site increase different.,Evidence itself all friend town relationship. Improve girl article music pay human society.,Technology,2.35,Keyview
511,Need red.,Court probably foreign blood technology through. Time organization order. Daughter leg traditional morning agree race.,Health,3.52,Candacemouth
512,Day Mrs draw total.,Who above offer test moment. Peace team woman learn nature. We phone guess itself.,Community,3.66,Cruztown
513,Simple or physical.,Help watch seem. Itself however firm TV rate. Scientist hold want scientist professional.,Health,1.78,North Mikaylamouth
514,Mother his gun economy.,All describe full surface clearly investment organization. Collection military century term recognize three. Before customer education open where official want property.,Community,2.18,Tinaville
515,Make training.,Agreement forget specific paper including affect military. See argue fire analysis run use rule.,Health,4.78,New Claudiatown
516,Themselves rest rule.,Sort land for trip real. Wonder various role general score.,Health,4.93,Victorport
517,Week low age.,Already another beat rich material edge future. Always ball under where result term perform. System house star discussion although power.,Education,1.08,Perezborough
