project_id,title,description,category,impact_score,location
171,Hard kitchen.,Star probably step. Debate heart treat study gas white. Worry indicate level.,Education,1.68,Toddport
172,Speak practice data total.,Best when benefit. Mission its mouth mission answer raise east. Take sell design left eight here window learn.,Health,1.67,Lake Linda
173,Fact attention catch different soldier.,Page total interest maybe resource nice picture. Plant soldier mind might conference here. Road road star next minute human account.,Technology,2.44,Anthonybury
174,Kitchen we fly of yes.,Why inside learn as its. Five work although. High allow care already adult.,Technology,3.7,Michaelfurt
175,Make large shake wife choice.,Allow last record oil economy for while attention. Rise try program. Today figure wall understand cold go.,Environment,1.24,Port Erik
176,Program how protect street oil.,Expert available senior who pay together memory. Cost trouble both him.,Community,2.8,Kristyton
177,Authority speech physical need nation.,Condition stand create measure trouble book operation school. Course become white during.,Environment,1.34,Lake Steven
178,Expect be.,Use large role television. Long sport ask meeting data employee.,Technology,4.28,Cynthialand
179,Represent probably oil field.,Few boy song night team. Paper experience both trial seat card no now. Year test investment after later maybe go. Against program ever resource.,Health,2.58,Port Mckenziechester
180,Media along food evidence.,Pm painting hour appear. Page agree might. Professor when cut watch challenge deal.,Community,1.92,East Sandra
181,Call administration first.,Budget could wish throughout number those manage. Assume billion letter someone pick large. Win article why bad.,Environment,3.56,Lake Jackiefurt
182,Class grow Congress.,Beat recognize action might listen hard structure. Option let turn technology leave. Item effort difficult go account their low.,Community,4.35,Douglasfurt
183,Common staff military.,Buy another cause military factor sure. Act type health south prepare others street. Reflect tend oil data artist.,Education,4.24,East Jacob
184,Company lose.,What nearly beyond. Leave staff eight agency surface feeling democratic include.,Technology,4.17,New Joyce
185,Future after few.,Floor unit politics become still participant.,Environment,2.56,Flowersstad
186,Out day.,Spring soon create thank value. Rock believe result old two season.,Technology,4.51,Mariashire
187,Agent do.,Article budget member area reflect lot opportunity foreign. Least stock Republican.,Environment,1.12,Lake Suzanne
188,Station avoid lead.,Board pass stop. Not determine toward society.,Education,4.74,Davidstad
189,Many student own.,Forget language music north without already pressure. Remember lawyer operation agent.,Environment,3.09,South Jerome
190,Create long coach change.,Direction however another opportunity exist. Authority herself fact growth line. Face particular TV opportunity.,Technology,1.27,Lorihaven
191,Believe leader yeah.,Order American seek will in central. Activity radio teacher if person hope.,Environment,3.49,West Deborahfort
192,Cultural explain dream sport.,Baby test idea type hotel event. Message ball conference democratic be could.,Environment,4.56,East Justin
193,Page energy wrong must.,Middle smile particular whether. Exactly market they middle morning.,Technology,4.11,West Benjaminmouth
194,Care foreign break economy.,True only president someone science decade. Available born Democrat president shoulder blue.,Community,1.21,Johnsonmouth
195,Successful especially serve.,Lawyer despite quite decide make begin player. Up debate others. Lot all simple artist daughter break our.,Technology,4.86,Peterstad
196,Push candidate find.,Though low mother herself its not world. Law important focus add friend. More go describe put dream prove experience.,Environment,4.71,Tammiechester
197,Produce large customer create.,Same sister cause someone way now person. Hundred home say.,Technology,2.67,Camachoburgh
198,View computer next.,Beat majority picture president the whose. Well election response manage.,Environment,1.09,Holmesshire
199,Thing establish mission beat.,Well ground father compare effect best list. Product join lawyer great likely.,Environment,3.72,Sarahmouth
200,Sound be pass.,Push shake read positive. Stuff wind party modern. Generation along parent dark outside fast.,Technology,2.87,Port Johnside
201,Heart century.,Themselves impact bit movie worry. Should school test whole cold source shake. Want off wife.,Education,3.37,Port David
202,Worry best important decade.,Impact control outside former exist focus our. Use poor hold area.,Technology,4.47,West Jasonshire
203,War word.,Fire at when way hotel include sort sing. Perhaps most participant dog.,Community,4.53,East Kevintown
204,Perhaps happen.,Too rock then if pay. Major cold project evening push. Field hold color plan white agree. A market maybe side.,Health,3.12,Millerport
205,Force involve authority since simple.,Style audience Mrs garden sister. Nation give discussion difficult imagine.,Education,1.76,East Josephtown
206,Size check.,Watch suffer I sure blue. Miss member treat admit. Carry shoulder wear measure class.,Community,2.63,Robertsonfurt
207,Discover increase.,Behind skin series center candidate such number. This fast nice finally and time story same.,Health,2.88,Alexanderstad
208,Shoulder page.,Positive offer head truth five. Certain my ready company positive. Cut mission idea PM bar party.,Environment,4.83,Goodwinview
209,Theory player.,Firm field according. Laugh machine time stock. Test young board.,Environment,1.29,Lake Jose
210,Nor model voice guess.,Relate sell record usually lawyer. Our water admit sign arm without. Serve give attack employee difficult.,Technology,2.98,South Keith
211,Pm officer skill own.,Style pass office these visit mention half. Poor respond financial test serve. Society television particular popular race.,Environment,2.72,East Courtney
212,Particularly me already.,International church eye part ok interesting win. Check study little. Economy discuss over program or keep ahead.,Technology,4.11,Stephenberg
213,Forward stage.,Radio contain story. Gun enter ahead here street carry player. Alone idea exist player attack summer far produce.,Environment,4.41,Loristad
214,Scientist control impact picture.,Author bar may person week environmental. Car yet reality other relationship laugh drop just.,Education,1.87,Karenmouth
215,Street authority no fine until.,International any stop save door. Election mission through itself charge country.,Community,4.88,Cynthiabury
216,Personal century cause green situation.,Tax process artist career drop. About team machine.,Technology,2.38,North Michael
217,Able particular.,Surface president unit issue common box late. Recognize option sit unit office. Religious send fact food.,Technology,2.08,New Kurt
218,Rise lay man.,Music eye order culture particularly. Commercial responsibility anyone.,Health,1.87,Shannonbury
219,Employee somebody clear office.,Hospital determine Mr down. Television different act quickly. Stop east in learn up agree. Picture learn official interest million vote able.,Technology,2.61,Vazquezland
220,Never old company.,Act serve you run. Role report research network past room sense. Center agreement administration image.,Health,4.91,Alexanderfurt
221,Character six your.,Recently better guess ready seek hundred speech heart. Way design I art image whole yeah. Information partner always.,Education,1.41,Campbellland
222,Agent good campaign.,Its medical score sell after purpose see effort.,Health,2.28,Gonzalezborough
223,Agree enter power at likely.,Hit worry leg person method run. North staff to line last thank likely. Economy along best.,Environment,3.51,Davisbury
224,Soon baby.,Plant individual seven answer order consider only. Order pattern continue create sort. Happy parent deep like necessary.,Environment,4.32,Lopezberg
225,Store partner fish under end.,Main one personal some turn economic create. Reveal remain positive hour attack property partner fund.,Health,3.77,East Douglasmouth
226,Which civil southern bag.,Them detail live recognize debate size. Wife cause nor along smile.,Health,3.09,South Sarahborough
227,Case check bag guy.,Human husband age hour while may. Young local option campaign those scientist.,Community,1.91,North Gary
228,Left white trouble father per.,Under address stay attack already. Above home rule job experience wife him. Require gun audience their note.,Environment,1.52,Jorgeton
229,Morning nation.,Radio wonder official you none special. Contain audience soldier unit. Participant style subject at.,Health,4.19,Schroederfurt
230,Carry become now defense accept.,Position easy late real statement history study gun.,Health,4.87,Davidton
231,Painting create able among.,Foot heart hold from. Always street pay staff strong might today.,Health,3.11,Lake Sethfurt
232,Everyone offer vote join.,Truth open defense.,Community,3.56,North Christopherfort
233,Fly Mrs series project require.,Agreement single lose city tell.,Technology,4.11,Nicholasview
234,Suddenly network choose woman sure.,Relate can party face feel believe only. Baby land interest treat pressure.,Community,3.09,Lake Ashleyshire
235,Type standard necessary.,Property teach military second behavior south. White order remain heavy it. Like special quality agreement few research.,Health,2.74,Ballardstad
236,Relationship whose nothing move go.,Network source still heavy method culture defense. Always effect various thought bring.,Environment,2.63,Smithbury
237,Like away hand positive relate.,Office outside page possible push a. Use commercial arm. Music base represent hope collection.,Community,3.31,West Kevin
238,Source if sound.,Sport then discover continue soldier. Deal pull wind line or special key. Operation machine husband final himself hold among. Another chance network man whatever trouble.,Health,4.31,Samuelview
239,Father whether.,Sign line address development article. Glass you method woman.,Health,4.01,Port Emilyport
240,Now doctor common.,Each usually article beyond part apply. Trial around magazine drop sell security among.,Community,3.57,Lake Davidside
241,Start glass course need.,Have approach since. Thus year report clearly property water head. Nothing partner feeling return.,Health,2.77,West Robert
242,Social idea here prevent.,Simple establish nor wish rich. Contain however pay walk how check down.,Education,3.41,South William
243,Rather kid black.,Reach stock anything shake special. Happen yard off enjoy even reason American. Best nearly visit conference today day.,Environment,3.71,West Emilyborough
244,Kitchen bit thousand.,Simply lead read often. Fire form reflect government him.,Health,4.51,Gordonview
245,Social court market space.,Foot couple just image off fire. Participant pressure face him himself technology compare.,Health,4.03,New Melissa
246,Second perform from science experience.,Boy either voice hold today. So day animal building.,Environment,4.19,East Sarah
247,Issue might day.,Common check cover animal long. Often service wish son.,Education,1.85,South Joshua
248,Protect state learn upon.,Window upon western consider coach key strong black. Foot our challenge in thought various development become.,Education,3.77,South Christinaburgh
249,Administration friend everyone reflect.,Age direction region. Yourself produce easy here score someone economy. Want none plan their a expert win.,Health,3.95,Martinezchester
250,Since sound nation.,Hold bring stay effort sometimes consumer tree drop. Administration some more option house standard high service.,Health,3.22,Lake Nathan
251,Difficult level prove.,Now arrive thus most all common return. Card series customer all another indeed I. Cut travel discussion last during. Blue which recent.,Technology,2.92,Hogantown
252,Article little.,Cold police event door enter draw. Major avoid wish establish time job. Four life technology message sign evening it reach.,Community,1.96,Masseyburgh
253,Teacher leg speech beautiful media.,By position serious. Current care student door life blood matter.,Environment,3.0,Lake Jill
254,Reality increase there tell.,Organization beautiful policy when. Sense decide almost site practice firm industry. Present boy article exactly court protect argue floor.,Environment,3.36,Kellyborough
255,Rock fall fish of allow.,Might which large responsibility most. Hope plan history even. Decision race author.,Health,4.1,New Whitney
256,Of stock.,Section agree including but office none.,Technology,1.01,Taraton
257,Story fish.,President kid study field subject reflect become machine. Member learn safe nice.,Environment,4.46,West Matthew
258,Option hour.,Culture different government whole glass move lawyer leave. Without public present difference court. Vote person anyone model two alone front community.,Community,1.09,South Jamesshire
259,Under spring.,Strategy in church wall every decade. Community face fear beautiful mother region positive. Lose get again information.,Health,1.6,Jimenezhaven
260,Talk gun sit give.,Suffer author effect provide network build.,Health,1.18,Rosariomouth
261,Husband piece range yes.,Space near western action million. Executive wide five car everybody majority respond.,Community,1.61,North Stephanietown
262,Professor ahead assume activity support.,Book American image pick. Police traditional administration measure mention body which. Always everyone newspaper what. Series result level cut nothing happy success Republican.,Health,3.12,North Heatherview
263,Base those themselves.,Poor something moment area Republican benefit court. Wide this upon white.,Education,4.09,Lake Karenville
264,Ability under.,Position risk individual. Treat concern tonight magazine. Energy less above house alone.,Community,4.13,Joshuaborough
265,Physical child.,Camera nothing baby fast federal goal. Majority have include sure dark including. Need kid travel price family morning education.,Technology,4.31,Wellsshire
266,Direction meet card allow.,Show billion little beautiful one. Image expert particularly word may.,Technology,4.34,Jerryland
267,Race such easy class.,She from indicate nothing race safe yard physical. Mrs past pattern rest view.,Community,2.86,Steinton
268,After investment save decide.,Age national feel station. Own during determine certain federal carry red.,Health,2.13,North Matthewton
269,Bar find Mr able.,Civil hour international staff would. Woman eat compare lead sell war painting.,Technology,3.47,Kevinborough
270,Threat his.,Stuff none wonder point them article.,Technology,1.58,Lake Christineburgh
271,Trip law concern there.,Skin raise produce. Former issue learn before science. Us way beyond every interview garden.,Community,2.93,Jeffreymouth
272,International sell you hold morning.,Tv case put people focus thing. Save bring collection rise get we.,Health,2.15,Jonathanfurt
273,Wife system face form firm.,Natural skin friend fly professional discuss someone. Guy will prevent authority. Which doctor improve far we true position forward. Family suggest international rate affect there mother.,Education,2.94,Madisonfort
274,Modern people stay her reason.,Her help really after. Late opportunity air me claim boy.,Education,3.56,West Sean
275,Once case mean.,Miss force be. Science however manager standard worry participant majority.,Education,2.75,Jamesstad
276,Entire along.,Parent so hospital number stay. Ahead throughout mind couple.,Community,3.4,East Marybury
277,Education kid way form billion.,Sea civil begin hundred. Support general life. Ago which police by hard.,Technology,4.72,Lake Adamfort
278,Together something size their.,Development support only recently present where. Trouble daughter course myself.,Health,3.44,Johnside
279,Investment bar.,Democratic front away both street least. Tv dinner too believe government goal life. Soon most evening medical produce respond. Pay security attention year should light door.,Environment,4.67,Saramouth
280,Later year process respond cultural.,Economy worry paper stage challenge provide part than. Because capital foreign tonight place. Rich risk billion.,Technology,4.05,New Amanda
281,Upon far too for.,Short staff know between cause finally. Also be community level exactly. Central development paper should western magazine course enough.,Technology,3.66,Jasontown
282,Statement truth.,Full history manage business pass. Hair nothing just something.,Health,3.15,South Williammouth
283,Nearly adult gas green.,Charge debate there environmental. Forward behavior easy will might. Fall song become difference fast section wish night.,Health,2.98,South Angelahaven
284,Town box everybody control.,Student live spring floor ok. Approach science among low heart meeting general recent. Old candidate many section treatment mother.,Environment,3.45,Jasonburgh
285,Outside by site work.,A contain section major Congress interest. Color of week operation space popular recognize.,Environment,1.84,Lake Alexander
286,Student break kid defense.,American yet security and explain own. Beat result right war. Particular service yard business network.,Community,2.96,Carterport
287,Experience well.,Bag rather require young prepare. Back base conference. Recently sea blood possible impact son environmental effect.,Technology,4.77,Rodriguezbury
288,Evening music half.,Three effort through manage however father. Say at need painting song.,Health,3.08,West Jenniferborough
289,Direction million.,Gun base fact series inside. Animal television catch apply you meeting trip. Cell least heavy ago early.,Community,4.78,Matthewshire
290,During ok recognize paper.,Top whole war admit turn Democrat. So themselves stuff appear win poor.,Technology,1.42,Grahamhaven
291,Oil follow.,Doctor writer reflect analysis sometimes case management. Development source eye employee own full chair.,Education,3.06,Davisshire
292,Explain friend player step.,Old although tough follow outside process. Price attack father anyone. Next Congress despite future.,Education,2.04,Lake Nicole
293,Pressure anything.,Seat wrong off do. Range option million rise back benefit. Scientist bag win training necessary less hear.,Environment,3.02,Georgeville
294,North young image may.,Before international per force. Dinner probably city.,Environment,3.41,Port Donald
295,Discussion red of.,Across because large environment share. Space analysis once course whose thus.,Technology,4.84,Jamesfurt
296,Product list tree recognize.,Operation her leg rise. Raise value mother sometimes surface nature game. Her science suffer.,Environment,3.7,Williammouth
297,Current business power.,Bad south effort maybe discussion now a. Decide war only body leg measure break weight. Alone walk product perform summer someone.,Health,1.51,Townsendton
298,Two condition.,In half amount source long impact lot. Allow organization dinner.,Education,3.68,West Jessicaton
299,Money leave special computer.,Main cost agent shake life. Whether contain deep drop girl day few. Network growth civil set truth.,Education,1.94,Maryport
300,Seat mind over.,Support bit beat. Appear at find large of money effort.,Health,1.8,Port Joanne
301,Same rest our draw.,Risk want last official like deal. Home loss fund soon. Who thus quickly ball agency it. Example success sea vote do suffer.,Community,4.4,Vegaview
302,Agent there court article.,Maybe school stand early. Mr rock sit fund.,Community,2.33,Sarachester
303,Human across understand theory.,Particular national five my large seem. Situation base explain we young billion.,Health,1.28,Guzmanmouth
304,Hundred end cup and technology.,Bad citizen film organization person over weight. Road avoid training wall including. Miss girl pattern case be.,Technology,4.56,Wrightshire
305,Scene show success represent.,Student state early technology community word show. Other fact security.,Environment,3.36,South James
306,Friend key after serious.,Address avoid fly recent law class arm policy. Authority physical minute computer writer impact. New card certain maintain.,Environment,3.8,South Keith
307,Try either him.,Economy message case rock recent challenge serious. And practice see control sure agreement town. Citizen commercial rather truth pressure news.,Environment,1.06,Lake Jenniferville
308,Since deep another.,Community score understand tough. Draw represent worry true continue important. Make skill on.,Environment,4.77,West Jeffreybury
309,Experience paper big.,Quite occur forget matter law customer. Way left probably hope order kitchen eight.,Health,1.71,Daltonborough
310,Evidence back catch eye discussion.,Finish ability country ahead well sometimes. Whether ten whatever put far trial seat. Mean group thought available son south nature.,Health,4.36,Dodsonmouth
311,Firm whatever.,Open ask serious former will carry for nothing. Already hope thought. Teach economy as politics environment same.,Environment,1.08,Greenfort
312,Teach leave write girl.,Range financial recognize window fact walk hot. Ever its point probably relate wall likely. Church effect build sea stand truth sit drug.,Education,2.23,Port Kimberlyberg
313,Area glass.,I practice stage difficult. Decision local increase their more space. Reach officer other rest difficult building. Write then money any.,Community,2.27,New Kimberlyside
314,Meet commercial charge someone.,Ask whole theory financial fine notice reach represent. Much call hundred board. Ok someone eye head yet national sister.,Community,1.59,New Henry
315,Officer staff.,Picture hand unit beyond finish so. Parent off forget including piece.,Health,3.39,Joyceside
316,Step already PM.,Traditional difference feel medical once day different. Wall radio speech role do later much.,Technology,1.65,South Alicia
317,Miss here effort outside enter.,Firm then officer none total century themselves move. Whole about various Mrs practice some. Hold brother watch whose center practice reason house.,Community,3.37,New Matthewstad
318,Table size term pressure.,Build view walk care conference million. Age create before mean return tough crime. Rather beat him less opportunity away senior animal.,Health,4.06,Johnsonview
319,Parent describe run news.,Husband stay court pull drug stage accept. Poor recently month daughter.,Environment,2.87,Port Bryan
320,General pressure that.,Class buy give first why. News future sense off.,Education,1.01,South Jennifer
321,Over know very.,Measure control suffer seem wall attorney. Need establish sure wife. Can kitchen week task truth probably live green.,Technology,2.15,East Susan
322,We card make marriage.,Play trouble help while friend your. Dream always word bag. Concern quickly fire very.,Health,2.51,Sarahview
323,Fact inside different.,Good dinner in plant really else industry. Tv education leg mean. Read evidence country large.,Technology,2.28,Clarkshire
324,He mother possible make make.,At degree then. Game nearly local production.,Community,3.52,New Nicoleland
325,Religious side sport home.,Civil red thing fall. Prepare with bit baby woman mind.,Technology,4.49,Brittanyview
326,Clearly safe over resource.,Side fire visit leg among traditional. Also fire letter decade age Mrs painting.,Health,4.47,Rollinsmouth
327,Event year management star have.,Imagine Mrs admit increase test discussion. Other role performance here. Child fly station describe after article.,Health,4.21,South Briannaberg
328,Thing over environmental describe southern.,Husband ball you president receive rule. Notice different politics speech environment American. Apply radio happy down its.,Technology,3.46,Port Lori
329,Each activity car media.,Check we develop hit. Break and sing agent. Road music heart reveal seem last.,Health,4.53,Lake Tina
330,Someone item home simply.,Conference understand notice condition suddenly. Local anything day though wall kid evidence. Owner movie truth far mean argue perhaps. For other appear once eye.,Health,3.6,Williamsberg
331,Field land sometimes control.,Act great seem without much once edge area. Suffer dream control hope it source fact. Wonder official deal.,Environment,1.39,Port Katherine
332,Firm she.,Upon name whose sea I. Person candidate trip nearly.,Education,1.87,New Chaseton
333,Gas heavy theory.,Later agreement visit success save sell could student. Floor sort child anyone hit effort study age. Involve operation or market dream employee.,Education,2.21,North Christinefort
334,Time hotel ask discussion.,Radio television require forget church page. Air true on they finally behind include. His through prove where society dinner.,Health,3.37,West Hunterburgh
335,Reflect anyone actually majority speech.,Town send nor much product standard task. Set say long study or American.,Education,1.03,Lake Dawnshire
336,Program specific poor economic local.,Image seven some public. Address course red save alone. Exactly us we seven hot.,Health,1.37,Fieldsborough
337,Course allow type mouth whole.,Statement care development wish. Too remember hair him such. Free pass control soon. Film end entire become man last.,Environment,4.32,West Zacharyport
338,Much memory create western.,Bring voice win hand degree. Whole offer police difference these camera pay.,Technology,1.62,Juliebury
339,South far financial.,Them key police back. Front establish hope doctor ago participant figure.,Community,2.41,Joneston
340,Court need alone.,Continue happy positive ball administration any.,Health,4.6,Saraton
341,Budget four recent.,Where rise there election Republican couple. Between high near general particular. Big question keep arrive until shoulder. Relationship capital book leg site race.,Health,4.49,Tracyland
342,Law interest painting thousand.,Either pull three education agency back. Lead decide under next ability. Large read loss rest rock huge.,Technology,3.87,Port Benjaminton
343,Four station foot account.,Traditional fill hundred check like. Side easy high mean assume think unit.,Health,3.04,Angelashire
