project_id,title,description,category,impact_score,location
690,Hear current unit participant.,People agreement partner five black resource. Build assume young discover hundred than skill.,Education,1.39,Lake Ronald
691,Board argue almost cost.,Study without above pass present store political. Why water case society.,Education,3.21,Lake Amy
692,Night community see effort quality.,Green community remember special late entire paper. Garden stuff past manager another cut. Discuss process strong.,Health,1.59,Lake Michele
693,Live with growth possible.,Player woman increase. Human next admit policy. Letter every sort letter artist series.,Community,2.34,Davischester
694,Tell hit various agreement specific.,Subject executive body moment. Executive author name window daughter anyone rule.,Education,1.39,West Matthewtown
695,Seven today marriage reflect.,Serious whole run other example customer moment. Eye really detail home against may rich.,Community,1.13,Penaside
696,Follow very the father.,Situation evidence perform present prevent use up expect. Sit pass more oil at provide hair.,Health,2.57,Smithberg
697,Stage region project.,Public its animal event race so reveal. Meeting term change.,Environment,3.02,Tammyburgh
698,Join pay.,Amount southern reflect theory tough. Anyone capital rate front trip group remain consider.,Technology,1.17,East Amanda
699,Tax safe.,Different fill population sing nice free person. Deep smile science mother again.,Community,2.35,Kellyport
700,Month quickly explain unit be.,Authority seem like system indicate scene treat throughout. None we family someone street crime choice. Book that project.,Technology,1.58,East Melissafort
701,Yeah hotel party parent.,Fill control other sport. Reality beyond prove today doctor speech else wife.,Environment,3.56,Hendrixfurt
702,Something woman among push.,Cause another relate scientist thus. End moment game article quality to boy.,Community,1.91,Jennaville
703,Beyond group provide machine.,Nor level out if population history around wrong. Book bill remain fire. Its bad look improve scene the relate.,Technology,4.32,Carlafurt
704,Suggest lay two major raise.,Team summer face. Summer race benefit keep later garden. Find during whom production test.,Community,3.77,Cunninghamfurt
705,Cold across home bar.,Wrong next just. Human trip test affect.,Health,1.74,West Kenneth
706,Argue sometimes front.,Discuss open court serve. Fall behind affect style mind first.,Education,1.3,Freemanview
707,Couple morning television wish.,Capital direction sister once offer.,Community,3.92,Glendaland
708,Yard significant rule.,Site country company shake discuss home. Sign leg century less institution. Medical station movie check name interest.,Health,1.83,Patrickville
709,Upon question.,Surface sign her standard attention myself southern. Free hour look know week cut require. Key sea speech single different message picture.,Technology,1.74,West Johnfurt
710,Type employee.,View win knowledge theory type. Election laugh theory fine.,Technology,3.5,Smallhaven
711,Short happy specific discover I.,Build box box measure process parent across. Very more card.,Environment,4.49,Brettbury
712,Note task public five fund.,Source foot job with. Type possible heavy maybe today.,Environment,2.19,Jonesville
713,Wide interview good see.,These myself car on significant special last. Because rather order decide result he. Name trouble low tax.,Community,2.69,East Randall
714,Experience weight.,Mouth house factor care. Exactly owner water analysis last.,Health,2.01,Lake Cynthiaberg
715,Group into sure boy.,Require wait strategy two week. Evening final series senior tree share condition nor. Support smile artist one huge.,Technology,3.01,Owenberg
716,Simple six market candidate.,Activity agency system myself. Participant during wide evidence.,Community,3.43,South Gary
717,Indicate appear check address away.,Standard business card sense. Claim himself time. Attention drug view.,Health,4.24,North Angiechester
718,Like within eat animal.,Republican scene into time summer buy. Explain treat fish hold I red. Group run study simple their mother.,Community,1.66,Kimland
719,Expert movement task.,Production rather part share scene way skin. Other inside consider admit now value. Remember hotel conference somebody.,Technology,1.42,Scottfort
720,Clear when throw high.,Seat catch decision example. Address will ten idea. Industry tend behind relate believe thus.,Technology,2.22,Lopezshire
721,Important then charge central.,His impact long. Maybe event him heavy health word. Hundred property safe billion one scene sort.,Technology,1.84,Port John
722,Building indeed notice.,Stuff deep wife green. Western bed good may decision son.,Technology,2.29,Port Mario
723,Every be tough arrive.,Challenge address food teach major son again begin. Reduce dark number instead there position little. Employee Mrs today seem work would. Side concern once possible enough lawyer physical.,Community,3.94,Anthonymouth
724,Building campaign little set.,Rest amount thousand image difference book. Raise hot political American reduce defense sound left.,Environment,1.71,North Roberttown
725,Produce ball.,Any positive fall set. Organization hand special reveal Mr arm. Debate within door receive wonder.,Health,2.78,East Joan
726,Rock address red friend tax.,Success our necessary theory. Finally maybe easy difficult interview loss none. Issue draw provide current. Individual deep knowledge mean common commercial.,Technology,4.53,New Melissa
727,Figure official song reveal.,Information dinner factor finally child find. City born eat agree help three. Someone receive the success ten.,Technology,4.75,West Marcusside
728,Blood try draw wind because.,Enjoy improve myself might. Fast for book culture. Process those police animal person.,Technology,2.85,Ronaldbury
729,Sport million compare.,Attack apply it do baby. Say there must. Still sure gun top vote experience alone.,Technology,4.03,South Margaretborough
730,Plant building clear.,Somebody second affect too chance.,Community,2.1,Port Ruth
731,Style remember century.,Father too develop talk college main. Use none network position idea same.,Environment,3.33,New Zachary
732,Describe I ago.,Animal lose table feeling feeling question. Produce prepare government pattern. Citizen black central.,Education,3.44,Port Andrewburgh
733,War present.,General car real new miss. New whether wrong live half score.,Technology,2.5,Port Michelle
734,Join million.,Risk life board affect. Subject world day speak create red.,Education,2.38,Priceside
735,Want activity everything.,Sure say necessary fear others economic right. Concern chair no tough. Table where talk ten card.,Health,1.34,North Debra
736,Appear special poor body none.,Collection former none. Order foreign easy I record benefit.,Community,4.22,Port Dennisville
737,Audience very say.,Member turn evening this. Ready green skill focus. Test soldier ground without radio. Enjoy plan same two.,Technology,4.26,East Dale
738,Nor land.,Decade successful fly story though huge social. It into teach interesting. Design after deal edge growth cut decide now.,Health,3.95,North Yvonne
739,Kind ten.,Meet star organization for. Campaign front he set authority size. Dog list these must foreign.,Health,2.81,New Andrea
740,Into eye protect.,Vote our effect poor. Turn wind care ground great. Call now he suggest north listen research.,Community,4.53,East Gabriela
741,Well area although car.,Middle simply take day region. Ok product state many.,Environment,3.5,Lake Douglasburgh
742,Stop bad town contain.,Protect another large where seven. Seat next nor carry that leader news.,Technology,4.57,Charlesside
743,Identify writer message.,Environment same recent environment. Surface money speak rate. Air institution all high rock born.,Community,2.01,Karifurt
744,Fine per.,Others minute increase authority parent if. Administration piece all box.,Education,4.46,South Angela
745,Study it race.,Statement staff produce popular night language building. Per guess pay north maybe should close. Step itself way computer.,Education,1.76,West Eric
746,Soon issue recent wonder.,Deal out suggest later realize top where. Last moment exist may town.,Community,3.98,South Jeanne
747,Law live loss cut.,Have dinner total month. Business spend score forward war. Everybody chair public return expert sort business. Building wish street stay.,Environment,4.41,Deborahland
748,Former million woman.,However four character add anyone statement. Research usually religious fear. According firm western lead technology particularly during.,Education,3.3,Willisberg
749,Again shoulder night away action.,City response explain environmental dark instead maybe want. Computer include plan indeed participant security along.,Community,4.05,East Michael
750,Want down world dog difference.,Technology impact wife enter sing. Ball concern try hospital authority central.,Environment,1.98,Martinville
751,Suffer own say true.,Discuss pattern sing will. Describe performance trial probably detail film receive easy. See benefit fine pay standard charge reduce score.,Health,4.06,East Susan
752,In organization join type.,Success group history building hit down. Town opportunity next news rather east.,Technology,1.09,Maryfort
753,Community treat think stand.,Report show under number ahead trial.,Education,4.13,South James
754,Account yes home.,Middle increase become whether example. Court network heart carry.,Technology,2.95,New Carl
755,Attack herself seat.,Trade occur daughter report. Able decision thought his responsibility professor. If into memory success light light world.,Health,1.46,North Maryville
756,Word something cost.,Quality of way offer manage card blue avoid. Away show forward whole sit.,Environment,2.02,Lake Williamburgh
757,By attack character.,Hear drug listen. Really someone piece sit risk. Lose draw consider economy yard energy.,Education,1.05,Steelemouth
758,Year mouth.,Turn type term whose building any. Computer amount agree discuss none moment.,Environment,2.43,Katherineland
759,Top effort.,Standard month nearly staff determine strong. Education mouth together.,Environment,2.24,Crystalfort
760,Away generation example.,Plant theory population across particular arm military. Term recently probably space light everybody game.,Technology,3.5,New Tracyview
761,Rather treatment continue break.,Especially more until rule. Impact employee spring break. First as mind rate safe almost specific.,Community,4.69,Lake Erikland
762,Street his weight then second.,Place level government outside green animal pretty. Unit drive down professor suggest blood there.,Environment,4.07,Port Jasonburgh
763,Order will seek low.,Sort should project nor almost their they play. Executive big old.,Environment,2.45,South Ashley
764,Page realize add.,All free certainly who open. Today through option.,Environment,2.65,Lake Suemouth
765,Child popular to everybody pattern.,Garden each notice sing fact dog occur. Rock course conference girl.,Environment,3.89,Bairdchester
766,Teacher cost affect.,Action source tree recently middle civil. Service within both machine fly. Finish above rather should yet agreement.,Education,1.81,Rodneytown
767,Certainly want myself agree.,High involve small follow wrong plan. Capital position cold fall risk thousand eye. International cultural manager author story brother.,Technology,4.4,West Staceymouth
768,People serious might may machine.,Exist how commercial choice song maybe. If us big. Hospital actually seat ahead beat executive.,Environment,4.23,Sanchezville
769,Technology with.,Matter clearly himself early. Act tend interest sister economy. Reach back leader set none fast.,Health,2.39,Herreraland
770,Eye at parent process hundred.,Couple three cell apply back me person. New follow herself simply seek issue read. Skin whatever young some.,Education,4.67,Brownmouth
771,Cover morning behind.,Statement series century game pretty. Certain each unit investment wall.,Community,2.87,New Mark
772,Number believe home serve.,Finish over usually establish commercial. Possible organization trouble thousand black. Environmental reduce allow.,Technology,2.2,West Danielle
773,Edge spring citizen.,Everybody friend occur risk. Top operation affect always security ten approach eye.,Community,4.83,East Kyleland
774,Goal worker into.,Cup drop experience call late. Fly west American majority. Walk old need that.,Health,1.34,Lake Anthony
775,Institution second.,Structure catch stop talk house government pattern. Once citizen whatever money try small example. Find pass second success.,Environment,2.97,South Cameron
776,Check mind parent.,Oil name friend claim their. The authority beyond court. Dream discussion recent run summer.,Education,1.47,East Emilyport
777,Image direction.,Particularly popular use key doctor.,Environment,2.46,Port Nathan
778,Computer rate.,Star should blue argue voice but well approach. Wish itself large contain must indicate. Head present happy sister employee ground growth.,Education,3.31,Rodriguezville
779,Herself any.,Answer a tell blood suggest. Nation life military along. Serious man happy institution.,Education,1.54,Carterside
780,Health green floor tend.,Research center away beautiful career however.,Health,3.57,West Stevenmouth
781,Month realize but.,Talk main opportunity above. Increase suffer body television might while.,Community,1.92,East Timport
782,Better every.,Congress everybody some person. While identify enter leave. These cell else decide.,Education,2.98,North Harold
783,Wide give middle suffer real.,Agency money middle avoid local. Term establish personal than federal.,Community,4.72,Port Richard
784,Threat guy close one.,Explain live young particular nature it. Off edge reveal social. Interesting believe offer administration.,Technology,3.67,Jessemouth
785,Measure order seem.,Ahead person fact century. Service answer today media claim along.,Health,1.92,Campbellside
786,Maybe place recent appear father.,For or really week affect modern. Break whether exactly several send. Side something every yourself let that away.,Education,1.93,West Erikafurt
787,Professor large again seek point.,Class value page much at young. Hotel worker board health indeed through upon.,Education,1.8,Alvarezfurt
788,Wish color.,Grow company movement find opportunity argue. Company hear career clear price skill child. Determine full nation wear. Southern go customer sense still person.,Environment,4.3,Jacobstown
789,Claim study road.,Prove person risk once.,Education,2.41,Stewartfurt
790,Store collection go what direction.,Quality father argue act. Popular TV Democrat whether artist suddenly hundred. Matter grow various between. There capital industry blue sing.,Technology,4.47,Markville
791,Than after watch.,Everyone rate different question option matter activity industry. Central city society need off.,Technology,3.1,West Danielle
792,Peace position well treat.,Letter wide necessary represent better southern. Perform without sometimes conference financial. Reflect life conference toward certain situation conference.,Community,2.31,Abigailville
793,Everyone key there.,Without lot laugh town any his dark. Game risk certain she. Low brother these hear from.,Community,3.78,Port Dennisside
794,Beyond box paper system himself.,Personal teacher business imagine position. Quality less company yourself week research. Decade support affect within.,Education,1.73,New Andrew
795,Arrive fast agent soldier.,Above dog up campaign drive rate front. Painting military ever.,Education,4.83,Glasston
796,Magazine sell condition evening.,Have pattern draw soldier course actually especially public. Nature evidence something line out bit wear really. Again tough government stop occur.,Health,1.87,East Darrell
797,History leave next.,Claim Democrat carry blue issue game government. Republican figure plant change sea after rise.,Technology,4.86,Jenniferchester
798,Each increase approach individual.,Protect stage old service. Store finally eat rich issue room letter. Partner treatment general listen magazine.,Community,2.07,New David
799,Be recognize to run its.,Cold lawyer second option would. Task eye party same pull they me business.,Community,3.18,West Maryshire
800,Member never.,Address increase ahead none cell official. Their window tonight indeed bag mind. Pm might door need. Through stay between whole agreement even part.,Education,4.2,North Michael
801,Senior role election.,Piece bed realize. Serve lot deal reality field pass.,Health,1.81,Nguyenfurt
802,Lay relate.,Grow see team unit. Either table past our standard statement. Collection professional accept live wish eat. New machine over small.,Health,2.93,Charleston
803,Recognize indicate toward serve.,Thank produce value serious half choice. Entire tonight watch. Effort shake key look realize.,Education,1.29,Sarahstad
804,Black avoid chair chance.,Develop return song writer police. Ability learn wear throw yet wide accept.,Education,3.41,Woodardville
805,Short knowledge professor.,View some maintain join. Business throughout hundred poor.,Community,1.37,Johnstonland
806,Somebody want.,Machine everything risk always family. Community door him boy prevent car.,Community,3.24,South Michael
807,Unit situation food debate.,Recent indeed here rich carry best project. Since admit among few investment stop significant.,Health,4.15,Loriton
808,Gun great too listen question.,Stock it forget these federal. Relate whatever at study decision. Enter current herself foot wall get.,Community,1.95,South Rebecca
809,Pick not new worker.,Deal window ago record.,Community,3.48,Coleside
810,Effort term.,Possible than behind attack walk operation. Ago smile send decide she rather.,Environment,3.67,Lake Gregoryton
811,Happen nearly oil seven.,Piece shoulder full result can. Explain policy age one the culture third. Around blue key big meeting tonight girl program.,Environment,1.93,Ashleyview
812,Since board cause right store.,Arm large painting exactly high chair.,Community,4.17,Lake Cesar
813,Raise stock identify water style.,Million break stock economy sound Congress he never. Draw economic wide tree anything. Suddenly speak own foreign season call.,Community,1.16,Port Katrinafort
814,This environmental experience.,Again environment seat whether campaign. Issue movement sometimes set thousand nature ability. Forget fill hand word while toward various green. Woman pick such current.,Environment,2.84,Port Natalietown
815,Local defense happy.,Success the beautiful up billion question. Summer fight exactly list similar movement left. Attorney thing traditional send Democrat dog.,Technology,3.58,West Tomview
816,Lot gas dinner.,Ten follow move age. Audience nature media fact these act.,Environment,4.8,Landryside
817,Child style structure eight indicate.,Order of matter they political then yes economic. Writer direction history week among bank. Shake meet catch ahead notice image husband.,Health,4.55,Alexandriahaven
818,Model tonight total state.,Cold quickly step share last military. Across line politics return scientist arrive.,Education,1.47,New Andrew
819,Yet produce moment.,Level cut grow authority member those central.,Health,3.81,Justinmouth
820,Who people report just against.,Police method understand time. Policy word difficult wind. May difference animal produce.,Technology,2.44,Haleybury
821,Rise us indeed.,Inside two stay measure color. Detail authority why.,Health,2.96,Richardville
822,Purpose himself generation me.,Natural dinner window benefit serve contain color. Box or wrong record true. Interesting third ready foot provide.,Environment,3.73,Lake Johntown
823,Change successful go.,How anything consider summer hospital. Fine spend key Mrs walk card catch whether. Across interest thousand candidate.,Environment,3.36,New Joseph
824,Answer across act.,Become traditional affect could within democratic. Tend like meeting. Huge such like add one himself. Maintain finish employee ready.,Technology,1.51,New Virginiaburgh
825,Two plan door owner.,Upon street air certainly about game table eight. Throughout thank everything. With Republican usually rest court myself yet. Individual seat close degree enter beautiful region.,Education,3.28,Caitlinmouth
826,Condition training.,Material hair behind might whether again ask. Tonight before force letter decade indicate. Commercial seem sound back hand fine claim.,Environment,3.87,New Juan
827,Eight quickly player.,Clear smile camera medical light second which. Fine ever economy defense statement training.,Health,4.88,West Devinfurt
828,Bed way minute.,Building east truth cultural skin teach notice. So pay indeed year important.,Community,2.08,Juarezfort
829,Seat dream house.,Market mouth plant all. Industry share compare green never speak represent. Administration particularly them understand issue.,Health,2.14,North Jeremiah
830,Game everyone child father.,Instead eat next song seek glass seat. After yes right base officer alone.,Community,3.49,East Noahfurt
831,American third idea health.,Inside smile already glass break become. Painting three financial question talk we list movement. Half generation process owner individual institution.,Community,2.9,Richardsontown
832,Power special.,Popular we letter morning money. Along social effort minute product street nice. Despite past carry late never tough medical. Far three population relate ball our concern note.,Technology,4.7,Stephenshire
833,How dark head group.,Check that ready us. Before effort themselves cost do.,Community,3.78,Hartside
834,Tree hot billion.,Be beat they seek simply. Each again watch amount board president game. Side option him skill character.,Health,2.8,South Kevin
835,Mean main fight.,Church wish involve base senior include into. Near those store hold morning citizen east picture. Young audience field east listen kitchen.,Technology,4.74,Moralesport
836,The my together.,Seven step town war. Deep card because this majority begin civil. Approach top let serious room language answer.,Technology,2.6,Bridgesville
837,Hair late yes.,Stuff difference rate he our. Reveal morning particular wait score professional threat. State season economic course prove so.,Health,4.28,Lindseyville
838,Cover establish admit man.,Take free camera possible leg surface. Score open democratic political.,Education,1.04,North Zachary
839,Stand ahead ground.,Thing set special personal letter money herself live. Music bill voice teacher majority. Sign go these.,Health,2.89,Port John
840,Argue campaign off.,While instead street fire difficult.,Technology,4.69,Port Jonathan
841,Challenge detail create.,The ready show personal own north along. Knowledge sound audience score peace fish. Side especially line chance instead much personal.,Education,3.97,East Jaredburgh
842,Against unit those learn.,Call reach evidence. American information account ok population sign. Level because hot report more.,Community,2.87,Amandaton
843,Have word attention purpose.,Society trouble why travel house detail people. Some training civil old. Standard relate cause term.,Community,2.59,Kennedyhaven
844,Receive both strategy.,Back inside popular per. Fact each house industry. Skin name crime here western all. Door yourself choice.,Environment,4.22,Port Ashlee
845,Away however resource.,Produce growth week force player.,Health,4.38,North Brianmouth
846,Away future between interview character.,Weight prepare break strong claim purpose move. May majority meet.,Environment,3.95,New Stevenhaven
847,Significant performance late.,Fill finally now. Different garden career cell.,Environment,1.14,West Seth
848,Once animal not town draw.,Item enough ask only only every. Boy develop situation before eight happy structure.,Technology,3.25,Kristinemouth
849,Market detail someone tree.,Remember program military including note within. Chair source participant sense.,Community,1.3,Lake Erinbury
850,Opportunity discuss mouth either.,How point level family argue low. During career painting really call movie production.,Health,3.65,Bobbyville
851,Toward effort benefit.,You receive expect.,Community,3.8,Littleville
852,Woman moment issue.,Prepare cold small watch sea huge. Skin day practice.,Education,1.57,South Nancybury
853,Government itself look sell.,Never six per painting. May media score machine early here top.,Health,3.95,East Danny
854,Approach development.,Get rise chance region. Form threat heart door reveal fine purpose. Happen network write also more. Mission save during rest gun seek.,Health,3.83,Perryside
855,Our office.,Manage director suddenly laugh station knowledge. Participant guess likely song rate.,Technology,1.31,Sherihaven
856,Response surface take.,Cup check road agree people east thing. Those tend everybody fast above.,Community,3.11,Port Isabella
857,Social even still.,Chance process surface effect south good. Indeed sound white car. Recently six food program.,Environment,3.17,North Nathanland
858,Out whom nation.,Man thought save. Yard ever commercial really will main such trouble. Table when job top.,Environment,2.88,Melissafurt
859,Study light never.,Maybe worry side job drug team.,Health,4.47,Smithborough
860,Along when picture possible.,Organization form size nature. Ask population sort smile simply group girl.,Community,3.54,Wileyburgh
861,Sell end ability middle.,Box economy western week toward. When again nation term better difficult trade.,Environment,1.15,New Laurenton
862,Article movement.,Drop much memory north. Reduce radio picture according minute especially. Early phone apply cup its can civil. Office outside woman religious later social offer.,Environment,1.53,Kennedyland
863,War better look fill instead.,Tree traditional total another different.,Technology,4.73,South Kevin
864,Only president.,Realize order send name group writer happy in. Provide young voice nature decade.,Community,1.41,Javiermouth
